{
  "schema": "activity-locale@2",
  "activityId": "ACT-9001",
  "version": "0.2.0",
  "locale": "en-US",
  "content": {
    "title": "Synthetic Paper Bridge Contract",
    "summary": "Compare paper shapes and improve a bridge so it supports more equal test pieces.",
    "openingQuestion": "Can one sheet of paper bridge a gap and hold a load?",
    "adultBrief": "Folds can make paper more resistant to bending.",
    "adultDetail": "Changing the cross-sectional shape changes how paper resists bending and distributes a load. Results depend on paper, span, folds, and load placement.",
    "childExplanation": "A flat sheet bends easily. Folds make little walls that help it keep its shape.",
    "reflections": [
      "Which shape held more pieces?",
      "What stayed the same for a fair test?"
    ]
  },
  "learn": {
    "goal": "Run two comparable tests and use the result to improve one paper shape.",
    "method": "Changing only the paper shape makes bending resistance visible while equal loads provide evidence for comparison.",
    "concepts": [
      {
        "id": "ENG-CON-STRUCTURAL-RIGIDITY",
        "name": "Structural rigidity"
      }
    ],
    "skills": [
      {
        "id": "MOT-SKL-PRECISE-FOLDING",
        "name": "Fold paper with control",
        "evidence": [
          "Makes repeated folds with decreasing help."
        ],
        "nonEvidence": [
          "Watching an adult fold."
        ]
      },
      {
        "id": "MAT-SKL-ONE-TO-ONE-COUNTING",
        "name": "Count one test piece at a time",
        "evidence": [
          "Adds one piece and updates the count once."
        ],
        "nonEvidence": [
          "Repeating another person's total."
        ]
      },
      {
        "id": "ENG-SKL-COMPARE-REDESIGN",
        "name": "Use test results to redesign",
        "evidence": [
          "Names one change and retests it under equal conditions."
        ],
        "nonEvidence": [
          "Changing several conditions without comparison."
        ]
      }
    ],
    "decisions": [
      "Choose one paper-shape change for the improvement test."
    ],
    "lookFors": [
      "Notice the amount of help used for each assigned action without grading predictions or physical results."
    ],
    "guidance": [
      {
        "skill": "MAT-SKL-ONE-TO-ONE-COUNTING",
        "rationale": "With no prior evidence, one-to-one counting during a real test is a useful starting opportunity for ages five to six.",
        "simplify": "Use fewer blocks and let the child touch each block while saying the number.",
        "extend": "Ask the child to recover the total after each waiting interval."
      },
      {
        "skill": "ENG-SKL-COMPARE-REDESIGN",
        "rationale": "With no prior evidence, proposing, testing, and revising a personal design provides an open challenge for ages seven to eight.",
        "simplify": "Offer two approved shapes and ask the child to choose one and predict its behavior.",
        "extend": "Ask the child to justify the redesign with two observations."
      },
      {
        "skill": "MOT-SKL-PRECISE-FOLDING",
        "rationale": "Folding is available to every participant but is selected as a primary objective only when evidence makes it useful.",
        "simplify": "Mark guides or stabilize the sheet while the child completes the fold.",
        "extend": "Ask the child to plan and repeat a chosen fold interval."
      }
    ]
  },
  "materials": [
    {
      "id": "MAT-COPY-PAPER",
      "name": "Equal copy-paper sheets",
      "prep": "Use equal undamaged sheets.",
      "safety": "Stop if a paper cut occurs.",
      "substitutes": [
        {
          "id": "SUB-EQUAL-CONSTRUCTION-PAPER",
          "name": "Equal construction-paper sheets",
          "conditions": "Run a new baseline with every bridge shape.",
          "rationale": "The mechanism remains paper-shape rigidity."
        }
      ]
    },
    {
      "id": "MAT-TEST-BLOCKS",
      "name": "Equal large test blocks",
      "prep": "Choose pieces too large to swallow.",
      "safety": "Never use coins, glass, or heavy weights.",
      "substitutes": []
    }
  ],
  "flow": {
    "states": [
      {
        "id": "STATE-READY",
        "text": "Materials are prepared and no result is known."
      },
      {
        "id": "STATE-PROBLEM-SEEN",
        "text": "Every child has observed the flat-sheet baseline."
      },
      {
        "id": "STATE-DESIGNS-CHOSEN",
        "text": "Every child has selected a paper shape."
      },
      {
        "id": "STATE-CHILD-DESIGNS-READY",
        "text": "Every child has a labeled bridge ready to test."
      },
      {
        "id": "STATE-CHILD-RESULTS-RECORDED",
        "text": "Every child completed a test and has a result."
      },
      {
        "id": "STATE-IMPROVEMENT-TESTED",
        "text": "The group selected and tested one improvement."
      },
      {
        "id": "STATE-EXPLANATION-SHARED",
        "text": "Every child connected a design to an observation."
      },
      {
        "id": "STATE-CLEARED",
        "text": "Materials are counted and safely stored."
      }
    ],
    "materialFunctions": [
      {
        "material": "MAT-COPY-PAPER",
        "purpose": "The paper is the bridge; its shape is the changed variable."
      },
      {
        "material": "MAT-TEST-BLOCKS",
        "purpose": "Each equal block is one load unit added during a test."
      }
    ],
    "roles": [
      {
        "id": "ROLE-BUILDER",
        "name": "Child investigator — folding focus",
        "contribution": "Completes the full cycle while the adult observes folding support.",
        "responsibilities": [
          "Propose, build, test, observe, recommend, and explain a personal bridge."
        ]
      },
      {
        "id": "ROLE-TESTER",
        "name": "Child investigator — counting focus",
        "contribution": "Completes the full cycle while the adult observes one-to-one counting.",
        "responsibilities": [
          "Propose, build, test, observe, recommend, and explain a personal bridge."
        ]
      },
      {
        "id": "ROLE-DESIGNER",
        "name": "Child investigator — redesign focus",
        "contribution": "Completes the full cycle while the adult observes evidence-based redesign.",
        "responsibilities": [
          "Propose, build, test, observe, recommend, and explain a personal bridge."
        ]
      }
    ],
    "groups": [
      {
        "size": 1,
        "notes": "The child completes one full personal cycle."
      },
      {
        "size": 2,
        "notes": "Both children complete a personal cycle; focus changes only the observation cue."
      },
      {
        "size": 3,
        "notes": "Every child completes a personal cycle; the group shares one improvement."
      }
    ],
    "steps": [
      {
        "id": "STEP-01",
        "title": "Ask",
        "purpose": "Elicit a prediction before anyone knows the outcome.",
        "transition": "The observed flat-sheet result creates a concrete problem to solve.",
        "instruction": "Show the gap and ask what a paper bridge needs to do.",
        "adultActions": [
          {
            "id": "STEP-01-ADULT-1",
            "text": "Position the supports and show one unloaded flat sheet."
          }
        ],
        "prompts": [
          {
            "id": "STEP-01-PROMPT-1",
            "text": "What do you think the paper will do when we add the test pieces?"
          }
        ],
        "participantActions": [
          {
            "id": "ACTN-01-ALL",
            "text": "Point, say, or draw a prediction without needing to be correct."
          }
        ],
        "materialUses": [
          {
            "material": "MAT-COPY-PAPER",
            "purpose": "Provide the flat baseline bridge."
          },
          {
            "material": "MAT-TEST-BLOCKS",
            "purpose": "Create equal load units in the baseline test."
          }
        ],
        "decision": "Choose whether to answer by pointing, speaking, or drawing.",
        "cues": [
          {
            "id": "CUE-01-PREDICT",
            "behavior": "Offers a testable prediction or question.",
            "doNotInfer": "Prediction accuracy is not evidence of understanding."
          }
        ],
        "result": "Children identify the span and load.",
        "success": "A testable need is named.",
        "problems": [
          {
            "problem": "A child seeks the correct prediction.",
            "safeResponse": "Record every prediction without grading it."
          }
        ],
        "warning": "Only the adult positions the supports.",
        "resume": "Return to the same support spacing."
      },
      {
        "id": "STEP-02",
        "title": "Predict",
        "purpose": "Turn several ideas into one testable shape and one fair condition.",
        "transition": "The baseline observation gives every child evidence for choosing a shape.",
        "instruction": "Draw or describe a paper shape that may resist bending.",
        "adultActions": [
          {
            "id": "STEP-02-ADULT-1",
            "text": "Show the flat sheet and the approved folded-shape diagram without naming a winner."
          }
        ],
        "prompts": [
          {
            "id": "STEP-02-PROMPT-1",
            "text": "Without adding paper, what shape could we give this sheet? What must stay the same?"
          }
        ],
        "participantActions": [
          {
            "id": "ACTN-02-ALL",
            "text": "Choose or draw a personal paper shape, predict its behavior, and name one condition that remains equal."
          }
        ],
        "materialUses": [
          {
            "material": "MAT-COPY-PAPER",
            "purpose": "Represent or demonstrate approved shape choices."
          }
        ],
        "decision": "Every child chooses one approved shape for a personal test.",
        "cues": [